author,website,message
Sade,wikipedia.org,arcu vel quam dignissim
Sarah,www.youtube.com,"tempus lorem"
Warren,,"Aliquam nec enim. Nunc ut erat. Sed nunc est"
Suki,purus@yahoo.net,"Duis mi enim condimentum eget volutpat ornare, facilisis eget"
Imani,cras@aol.net,"nec ante blandit viverra. Donec tempus lorem fringilla ornare"
Delilah,,"sit amet consectetuer adipiscing"
Amber,,"et lacinia vitae sodales at"
Perry,,"nulla magna, malesuada vel convallis in cursus et eros."
Irma,,Nam consequat dolor vitae dolor. Donec
Hope,,ipsum. Suspendisse sagittis. Nullam vitae diam. Proin dolor. Nulla semper
Zachery,faucibus.leo@icloud.com,"ornare, lectus ante dictum mi, ac mattis velit justo"
Melvin,ac.arcu@icloud.com,"enim consequat purus. Maecenas libero est congue"
Wylie,vestibulum.nec@aol.ca,"amet consectetuer adipiscing elit. Aliquam"
Brynn,lobortis@icloud.ca,risus. Nunc ac
Shannon,dignissim@protonmail.ca,feugiat. Sed nec metus facilisis
Adrian,et.arcu@hotmail.edu,cubilia Curae Donec tincidunt. Donec vitae
Indigo,feugiat@outlook.edu,"Integer sem elit pharetra ut,"
Caldwell,duis.at.lacus@yahoo.com,"elit dictum eu eleifend nec"
Sage,,"eu euismod"
Neil,,a purus. Duis
Karina,libero@hotmail.org,pede. Cum sociis natoque penatibus et magnis dis
Brian,litora.torquent@icloud.edu,"et lacinia vitae sodales at velit. Pellentesque ultricies dignissim lacus."
Callie,netus.et.malesuada@icloud.edu,sit amet ornare lectus justo eu arcu. Morbi sit amet
Victoria,dui@google.couk,Nulla eget metus eu erat semper
Keefe,est.arcu@aol.net,"enim. Sed nulla ante, iaculis nec eleifend non, dapibus"
Suki,vulputate.eu.odio@icloud.ca,"aliquet sem ut cursus luctus ipsum leo elementum sem, vitae"
Lewis,tincidunt.neque.vitae@icloud.org,faucibus. Morbi vehicula. Pellentesque tincidunt tempus risus. Donec
Kyle,malesuada.malesuada@aol.edu,fermentum arcu. Vestibulum ante ipsum
Silas,donec.fringilla@yahoo.couk,nulla. Integer urna. Vivamus molestie dapibus ligula. Aliquam
Iliana,sagittis@icloud.net,"felis. Donec tempor, est"
Iona,gravida.sagittis@google.org,metus vitae velit
Lara,natoque.penatibus@outlook.couk,"mollis dui in sodales elit erat"
Yardley,amet.consectetuer@yahoo.edu,"dictum eleifend"
Rooney,a@protonmail.edu,condimentum. Donec at arcu. Vestibulum ante
Wesley,nam.ac.nulla@protonmail.net,"est tempor bibendum. Donec felis orci adipiscing non"
Holmes,donec.sollicitudin.adipiscing@aol.com,"eu lacus. Quisque imperdiet erat nonummy ultricies ornare"
Zenaida,enim@yahoo.edu,Pellentesque tincidunt tempus risus. Donec egestas. Duis ac arcu. Nunc
Winifred,tincidunt@outlook.edu,gravida nunc sed pede. Cum sociis
Wallace,dictum.ultricies@yahoo.net,"sodales at velit. Pellentesque ultricies dignissim lacus. Aliquam rutrum"
Alexis,dictum.placerat.augue@icloud.edu,"Donec felis orci adipiscing non luctus sit amet faucibus"
Zephr,dolor.egestas@hotmail.ca,"elit. Aliquam auctor velit eget laoreet"
Nola,malesuada.vel@outlook.couk,rhoncus. Proin
Boris,mauris.non@outlook.couk,"Duis cursus diam at pretium aliquet metus urna"
